PRIMESTOCK; AND; DEFECTIVE ITEMS;;;;;TRANSACTION:;T_INV02201612161479;;;;;DISPOSAL REFNO:;D20161220004TYPE: ; CHOPPING;;;;;POSTED DATE:;0000-00-00LINE NO;ITEM #;DESCRIPTION;TOTAL QTY;SRP;SRP AMOUNT;PRODUCT COST;PROD COST AMOUNT1;262031;NOTEPAD HMK PPSY PINK 11262031;1;29.50;29.5;8.75;8.752;936494;SCRPBK ACC FLOWER AAS GIGGLES SATIN 41936494;1;26.00;26;9.07;9.073;995108;AAS TOOLS CLEAR ALL PURPOSE GLUE;2;56.50;113;22.3;22.34;286066;DATEBOOK 2016 HMK DB CHEVRON PATTERN 72286066;35;18.50;647.5;34.98;204.055;639032;BOOKMARK HMK MGBM BE GLAD AND REJOI;2;26.00;52;4.7;4.76;766383;CARD HMK HCC ENJOY OUR LIFE POP-UP;1;15.00;15;9.56;9.567;687012;STICKY NOTES HMK HYSN HOOPS;1;35.50;35.5;7.87;7.878;639041;BOOKMARK HMK MGBM WHOEVER IS;1;26.00;26;1.4;1.49;261335;GIFT TAG HMK GE BABY 11261335;1;3.75;3.75;0.72;0.7210;630041;AMPH FROM THE BEGINNING;1;24.50;24.5;5.84;5.8411;273044;CARD HMK THC DREAM AND AS;2;24.50;49;10.08;10.0812;321082;MGLI THOUGHT YOU MIGHT;1;11.75;11.75;10.83;10.8313;766822;CARD HMK HCC CIRCLES W/ DIFF PATTER;2;22.50;45;14.64;14.6414;273017;CARD HMK THC OUR LOVE 11273017;1;26.00;26;8.54;8.5415;766393;CARD HMK HCC JUST FOR YOU POP-UP;9;15.00;135;19.12;86.0416;766163;CARD HMK HCC PINK ENVELOPE 11766163;1;15.00;15;6.55;6.5517;766233;CARD HMK HCC YELLOW RIBBON 11766233;4;15.00;60;26.2;26.218;766243;CARD HMK HCC FLOWER POT 11766243;1;15.00;15;6.55;6.5519;766263;CARD HMK HCC BLUE HEARTS 11766263;1;15.00;15;6.55;6.5520;766183;CARD HMK HCC 2 PINK HEARTS 11766183;2;15.00;30;13.1;13.121;616057;BOOKMARK HMK AMW GREEN 11616057;1;39.50;39.5;14.94;14.9422;766514;CARD HMK HCC THANK YOU MINI HMADE 11766514;1;15.00;15;11.28;11.2823;389123;STICKER HMK PFFSL PAD LABEL HOME 11389123;1;26.00;26;8.27;8.2724;766293;CARD HMK HCC SWEET POP-UP;6;15.00;90;28.68;57.3625;254045;BOOKMARK HMK BYMB BEING FRIENDS 11254045;13;8.50;110.5;2.62;34.0626;766173;CARD HMK HCC 1 ROSE W PINK RIBBON 11766173;1;15.00;15;6.55;6.5527;766133;CARD HMK HCC RED ENVELOPE 11766133;1;15.00;15;6.55;6.5528;766442;CARD HMK HCC LADYBUG MINI HMADE;1;18.50;18.5;6.02;6.0229;766424;CARD HMK HCC HEART MINI HMADE 11766424;1;15.00;15;11.28;11.2830;766472;CARD HMK HCC FOR SOMEONE SPECIAL;2;18.50;37;12.04;12.0431;766882;CARD HMK HCC SML YELLOW FLWRS;1;22.50;22.5;7.32;7.3232;766432;CARD HMK HCC FLWR YLW BG MINI HMAD;4;18.50;74;18.06;24.0833;766643;CARD HMK HCC THANK YOU 11766643;2;15.00;30;9.56;19.1234;766213;CARD HMK HCC FLOWER BOX 11766213;4;15.00;60;6.55;26.235;766223;CARD HMK HCC RAFFIA RIBBON 11766223;3;15.00;45;6.55;19.6536;766333;CARD HMK HCC BIRDS POP-UP;7;15.00;105;9.56;66.9237;766353;CARD HMK HCC CUPCAKE POP-UP;16;15.00;240;9.56;152.9638;766402;CARD HMK HCC BTRFLY MINI HMADE;4;18.50;74;6.02;24.0839;766862;CARD HMK HCC ORANGE FLOWER;3;22.50;67.5;14.64;21.9640;766253;CARD HMK HCC WHITE FLOWERS 11766253;3;15.00;45;6.55;19.6541;766323;CARD HMK HCC BEE POP-UP;8;15.00;120;19.12;76.4842;766313;CARD HMK HCC RAINBOW POP-UP;12;15.00;180;19.12;114.7243;766343;CARD HMK HCC BALLOONS POP-UP;7;15.00;105;9.56;66.9244;766373;CARD HMK HCC AIR BALLOON POP-UP;10;15.00;150;19.12;95.645;766153;CARD HMK HCC FLITTERED HEART 11766153;3;15.00;45;6.55;19.6546;766273;CARD HMK HCC PINK RIBBON 11766273;4;15.00;60;6.55;26.247;766303;CARD HMK HCC YEL FLWR POP-UP;2;15.00;30;9.56;19.1248;766283;CARD HMK HCC HEART LOVE POP-UP;7;15.00;105;19.12;66.9249;766193;CARD HMK HCC WATER SPRINKLER 11766193;6;15.00;90;6.55;39.350;698021;SCRPBK ALBUM AAS CHIPBOARD PAW;2;79.50;159;34.54;69.0951;758034;GIFT BAG HMK XHB MINI PASKONG PINOY 12758034;10;32.50;325;44.59;63.752;256379;NV BAPTISM (CROSS);1;26.00;26;1.04;1.0453;256041;CARD HMK NV BABY ROCKING HORSE 11256041;1;15.00;15;4.3;4.354;722061;CARD HMK VS HAPPY BIRTHDAY 11722061;1;37.00;37;8.27;8.2755;248044;GIFT BAG HMK B1T1 HYHB TINY BAG;1;24.50;24.5;7;756;936233;SCRPBK ACC BOUQUET AAS GLASS FLOWER WITH LVS 41936233;1;22.75;22.75;9.63;9.6357;060033;CARD HMK B IM NOT LATE 11060033;1;29.50;29.5;5.07;5.0758;911762;GIFT WRAP HMK NW FLORAL BLUE BG 11911762;2;46.50;93;16.31;32.6159;911772;GIFT WRAP HMK NW FLORAL RED BG 11911772;2;46.50;93;16.31;32.6160;911076;NW PLN YELLOWENW;2;19.75;39.5;5.74;11.4861;315052;CARD HMK FDC FISHING ROD 12-315052;1;49.50;49.5;16.35;16.3562;404031;CARD HMK PC FOR A SPECIAL FRIEND 11-404031;3;49.50;148.5;16.01;48.0363;231161;CARD HMK BBTQ THERES ONLY 11231161;1;32.50;32.5;5.3;5.364;097171;CARD HMK B SISTERS AROUND THE WORLD 11097171;1;29.50;29.5;1.47;1.4665;126053;CARD HMK B DAD YOU WERE ALWAYS THERE 11126053;1;35.50;35.5;1.74;1.7466;286044;PLANNER DATEBOOK HMK DB LIVE LOVE LAUGH 72286044;1;18.50;18.5;6.31;6.3167;232091;CARD HMK DZ FOR YOUR BIRTHDAY 11232091;2;46.50;93;15.03;30.0668;274051;CARD HMK SGC CUPCAKE;1;42.50;42.5;12.94;12.9469;404011;CARD HMK PC FOR THE BIRTHDAY GIRL 11-404011;1;49.50;49.5;16.01;16.0170;202052;CARD HMK MCSO HAPPY BIRTHDAY;3;99.50;298.5;13.33;39.171;202022;CARD HMK MCSO MAY YOU BE BLESSED;3;99.50;298.5;13.33;39.172;202031;CARD HMK MCSO HAPPY BIRTHDAY..;2;99.50;199;11.56;23.1373;837190;SCRPBKACC SHELLS AAS SHM PASIO 15IN;1;19.75;19.75;5.38;5.3874;828071;CARD HMK BTL LIFE IS GOOD 11828071;1;32.50;32.5;5.29;5.2975;323061;KMP MALIGAYANG KAARAWAN, INAY;1;19.75;19.75;3.3;3.376;774010;CARD HMK IMPTD HVC HEART WITH RIBBON;1;39.50;39.5;12.22;12.2277;198018;CARD HMK MC THE TIMES IT TAKES TO HEAL 11198018;2;99.50;199;32.6;65.278;198048;CARD HMK MC THOUGHTS AND PRAYER 11198048;2;99.50;199;32.6;65.279;198125;CARD HMK MC WITH SYMPATHY 11198125;2;99.50;199;32.6;65.280;198028;CARD HMK MC IN MEMORY OF SUCH A 11198028;1;99.50;99.5;32.6;32.681;404081;CARD HMK PC I'M SO GLAD WE'RE... 11-404081;1;49.50;49.5;16.01;16.0182;242171;CARD HMK SC WELL BONJOUR THERE 11242171;1;59.50;59.5;12.98;12.9883;707747;CARD HMK BYM KISSING TOUCHING 11707747;9;35.50;319.5;6.21;55.8984;198058;CARD HMK MC GOD IS LISTENING 11198058;1;99.50;99.5;32.6;32.685;198068;CARD HMK MC WITH GENTLE STRENGTH AND 11198068;1;99.50;99.5;32.6;32.686;242331;CARD HMK SC YOU PUT THE MERRY 11242331;2;59.50;119;45.24;45.2487;570100;SCRPBK AAS FRAMES HSK 12X12 BLSMS;1;8.50;8.5;1.25;1.2588;766422;CARD HMK HCC HEART MINI HMADE;2;18.50;37;6.02;12.0489;766872;CARD HMK HCC CAKE;1;22.50;22.5;7.32;7.3290;766502;CARD HMK HCC HEART BLUE BG MINI HM;1;18.50;18.5;6.02;6.0291;137030;CARD HMK B SON 11137030;1;49.50;49.5;2.46;2.4692;766211;CARD HMK HCC WISH FLORAL BLUE MINI 11766211;1;11.75;11.75;8.17;8.1793;524120;VGI RED WHITE CRISS CROSS;1;19.75;19.75;15.3;15.394;794195;PACKAGING CONTAINER 41794195 IPH HAT GREEN;6;99.50;597;83.2;249.5895;747055;MGLM GOD BLESS THE HEARTMGLMMGLM;1;11.75;11.75;4.02;4.0296;837212;CRAFT EASY ACC SHELLS SHM LIGHT BROWN 8IN 41837212;4;19.75;79;29.2;29.297;819134;SCRPBK ACC BUTTONS AAS ENGRAVED EDJOYS 41819134;5;29.50;147.5;39.04;48.8198;772034;BOOKMARK HMK HYMB YOYO;1;22.50;22.5;1.62;1.6299;777248;AAS ACC METALLIC FOAM BOARD SILVER;1;20.00;20;11.38;11.38100;425014;GIFT WRAP HMK XW FORMAL 12425014;1;13.50;13.5;4.1;4.1101;981094;GIFT BOX HMK KBX BLUE MERRY CMAS SML 12981094;1;69.50;69.5;30;30102;777721;SCRPBK ACC CHIPBOARD TAGS AAS FLOWER PURS FLOKD A 41777731;1;39.75;39.75;16.12;16.12103;819370;SCRPBK ACC BUTTONS AAS CLR SHPD FRE;1;6.00;6;8.28;8.28104;936018;SCRPBK ACC FLOWER RESIN AAS BLOSSOM 6IN 41936018;1;21.75;21.75;6.53;6.53105;777489;AAS ACC GEM BRDR LAV HRT;1;42.50;42.5;7.83;7.83106;837171;SCRPBKACC SHELLS AAS SHM BROWN 15IN;1;21.75;21.75;4.61;4.6107;936046;SCRPBK ACC FLOWERS AAS BLOSSOMS JEWELRY 41936046;2;26.00;52;12.44;12.44108;764181;LETTER SET IMPTD ST YELLOWBUD ROSE;1;11.75;11.75;9.03;9.03109;846075;GIFT BOX HMK KBX GREEN EMBOSSED SML 11846075;1;94.75;94.75;42.35;42.34110;939904;GIFT BAG HMK PB MULTICOLORED PEARL HNDLE BIG 11939904;2;39.50;79;39.76;39.76111;969175;GIFT ACC HMK XGA FELT MITTEN WITH STICK 12969175;1;22.50;22.5;7.48;7.48112;969145;GIFT ACC HMK XGA FELT RED FLOWER WITH RIBBON 12969145;1;22.50;22.5;7.48;7.48113;510025;ENVELOPE PRINTED SHORT HMK SM FPPE SPLATS 510025;22;31.75;698.5;10.25;225.39114;782012;SCRPBK SHADOW BOX AAS LM MEMO KEEPER WITH FLOWERS 41782012;4;285.00;1140;139.37;557.48115;620022;CARD HMK AMBD HAVE A FLOWER 11620022;1;52.50;52.5;7.12;7.12116;836031;SCRPBKACC KITS AAS SHM YELLOW;1;26.00;26;6.32;6.32117;611031;JOURNAL HMK EGJ W/PENCL RED BTRFLY;1;79.50;79.5;18.06;18.06118;852092;GIFT BOX HMK RGB 8X8 BROWN 11852092;1;52.50;52.5;17.75;17.75119;936220;SCRPBK ACC FABRIC AAS FLOWER LOVE 41936220;1;26.00;26;8.33;8.33120;987864;SCRPBK ACC FEATHERBAND AAS EDJOY 41-987864;1;22.50;22.5;11.64;11.64121;936394;SCRPBK ACC FLWR AAS PAPER NOSTALGIA 41-936394;1;26.00;26;16.16;16.16122;936366;SCRPBK ACC FLOWER AAS PAPER SUMMER 18IN 41936366;1;35.50;35.5;11.88;11.88123;936374;SCRPBK ACC FLWR AAS PAPER LOVE 41936374;3;26.00;78;48.48;48.48124;255146;CARD HMK T FORMAL FLORAL;1;29.50;29.5;4.43;4.43125;994179;C;1;10.50;10.5;1.71;1.71126;936371;SCRPBK ACC FLOWER AAS PAPER NOST;2;49.50;99;26.24;26.24127;819380;SCRPBK ACC BUTTONS AAS CLR SHPD LOV;1;6.00;6;8.28;8.28128;819144;SCRPBK ACC BUTTONS AAS ENGRAVED SUMMER 41819144;6;29.50;177;58.56;58.56129;652175;ENVELOPE PRINTED LONG HMK PE TILES 11652175;2;27.00;54;11.3;22.6130;936364;SCRPBK ACC FLWR AAS PAPER LITTLE BOY 41-936364;5;26.00;130;80.8;80.8131;936344;SCRPBK ACC FLWR AAS PAPER ED JOYS 41936344;1;26.00;26;16.16;16.16132;936384;SCRPBK ACC FLWR AAS PAPER RETRO 41936384;1;26.00;26;16.16;16.16133;936354;SCRPBK ACC FLWR AAS PAPER LITTLE GIRL 41936354;3;26.00;78;48.48;48.48134;726101;SCRPBK ACC BRADS AAS LEAVES METAL 10IN 41726101;1;26.00;26;8.03;8.03135;936361;SCRPBK FLOWER AAS PAPER LOVE;1;49.50;49.5;14.41;14.41136;255021;T THANK YOU SQUARESTT;1;26.00;26;3.79;3.79137;284075;CALENDAR 2015 DESK HMK DC EVERYDAY 12284075;6;56.50;339;34.78;104.34138;944024;STICKER HMK HYST HAPPY BIRTHDAY;1;16.75;16.75;2.5;2.5139;747052;MGLM TO KNOW SOMEONE WHO CARESMGLM;1;16.75;16.75;1.38;1.38140;286086;DATEBOOK 2016 HMK DB GRAPH 72286086;87;18.50;1609.5;34.98;507.21141;284085;CALENDAR 2015 DESK HMK DC LOVE YOUR 12284085;16;56.50;904;34.78;278.24142;443216;CARD HMK V FOR A GOOD FRIEND 12443216;10;19.75;197.5;11.58;38.55143;262021;NOTEPAD HMK PPSY DOG 11262021;1;29.50;29.5;8.75;8.75144;766434;CARD HMK HCC PINK RIBBON MINI HMADE 11766434;1;15.00;15;11.28;11.28145;766504;CARD HMK HCC CONGRATULATIONS MINI HMADE 11766504;1;15.00;15;11.28;11.28146;428474;GIFT TAG HMK XT CONTEMPORARY 12428474;9;2.75;24.75;0.6;5.4147;428114;GIFT TAG HMK XT FORMAL LETTERING 12428114;6;2.75;16.5;0.42;2.52148;673117;CARD HMK MTC WE LOOK AHEAD 11673117;3;7.50;22.5;4.41;4.41149;261328;GIFT TAG HMK GE FORMAL ON LT.GREEN;1;3.75;3.75;0.8;0.8150;261364;GIFT TAG HMK GE DOTS AND STRIPES 11261364;1;3.75;3.75;0.4;0.4151;428154;GIFT TAG HMK XT JUVENILE 12428154;1;2.75;2.75;0.32;0.32152;766464;CARD HMK HCC YOURE A SPECIAL PERSON MINI HMADE 11766464;1;15.00;15;11.28;11.28153;646052;DORA STICKER SHEETS NKS MAKING A;10;19.75;197.5;4.55;45.5154;675159;CARD HMK THK INSPIRATIONAL 11675159;4;4.50;18;2.64;2.64155;646022;DORA STICKER SHEETS NKS WHAT A BUBB;1;19.75;19.75;4.55;4.55156;675171;THK THE FUTURE BELONGS TO THOSE;1;4.50;4.5;0.59;0.59157;428144;GIFT TAG HMK XT JUVENILE 12428144;11;2.75;30.25;0.64;3.52158;428052;GIFT TAG HMK XT RED GREEN PLAID;1;2.75;2.75;0.75;0.75159;936503;SCRPBKACC FLWR AAS LOVE SATIN;1;32.50;32.5;7.97;7.97160;269175;BOOKMARK HMK BM INSPIRATIONAL 11269175;1;6.50;6.5;0.9;0.9161;428104;GIFT TAG HMK XT FORMAL LETTERING 12428104;8;2.75;22;0.84;3.36162;428444;GIFT TAG HMK XT CONTEMPORARY 12428444;6;2.75;16.5;1.2;3.6163;675048;CARD HMK THK GOD HAS BLESSED;4;4.50;18;0.75;2.98164;286076;DATEBOOK 2016 HMK DB ICE CREAM CONE 72286076;22;18.50;407;11.66;128.26165;428464;GIFT TAG HMK XT JUVENILE 12428464;11;2.75;30.25;0.36;3.96166;261949;GIFT TAG HMK GE GREEN SOLID;1;2.75;2.75;0.7;0.7167;261225;GIFT TAG HMK GE GREEN FLORAL ON GRAY 11261225;1;3.75;3.75;0.77;0.77168;261718;GIFT TAG HMK GE ORANGE DOTS AND HEXAG;1;3.75;3.75;0.48;0.48169;703021;GIFT TAG HMK NKGE SPENCER AND ICARLY;1;3.75;3.75;0.75;0.75170;792061;SCRPBKACC ICONS AAS LM FTHR W/TINY;1;49.50;49.5;13.69;13.69171;269097;BM IN EVERY BLOSSOM...;1;6.50;6.5;1.23;1.23172;675122;THK IT IS IN DREAMING...;2;4.50;9;1.3;1.3173;269199;BOOKMARK HMK BM GEMINI;2;16.75;33.5;1.49;2.98174;671061;RBM THERE IS NO GREATER STRENGTH;2;8.50;17;2.6;5.2175;678085;SCRPBK ACC ICON AAS FLOWER WOOD WITH ADH 41678085;1;27.00;27;7.39;7.39176;834021;MGDP I HAVE TAUGHT YOU THE WAY;1;39.50;39.5;3.26;3.26177;286056;DATEBOOK 2016 HMK DB GIRL AND COFFEE 72286056;47;18.50;869.5;5.83;274.01178;675232;THK OPEN YOUR ARMS TO RAINBOWS;1;4.50;4.5;0.59;0.59179;675203;THK KINDNESS IS A BEAUTIFUL STONE;1;4.50;4.5;0.59;0.59180;273057;CARD HMK THC REAL LOVE 11273057;1;26.00;26;8.54;8.54181;819154;SCRPBK ACC BUTTONS AAS ENGRAVED LBOY 41819154;1;29.50;29.5;9.76;9.76182;629875;GIFT BAG HMK HB MINI FEMININE ANYDAY 11629875;9;32.50;292.5;14.24;64.08183;629035;GIFT BAG HMK HB MINI FEMININE FLORAL 11629035;2;32.50;65;7.12;14.24184;758091;GIFT BAG HMK XHB TINY CONTEMPORARY 12758091;11;24.50;269.5;23.6;51.88185;629625;GIFT BAG HMK HB BIG MASCULINE 11629625;7;52.50;367.5;28.62;100.17186;629915;GIFT BAG HMK HB BIG FEMININE ANYDAY 11629915;2;52.50;105;28.62;28.62187;629845;GIFT BAG HMK HB BIG BABY 11629845;3;52.50;157.5;14.31;42.93188;501316;GIFT BAG HMK XPB GOLD XMAS TREE MED 12501316;1;63.00;63;18.71;18.71189;501406;GIFT BAG HMK XPB WINE BAG GOLD STARS 12501406;1;56.50;56.5;16.43;16.43190;745215;GIFT BAG HMK PB KRAFT RED HANDLE 11745215;1;69.50;69.5;18.17;18.17191;758064;GIFT BAG HMK XHB SML PASKONG PINOY 12758064;1;42.50;42.5;8.31;8.31192;641163;GIFT BAG HMK EGHB GREEN DIAMOND PATTERN BIG 11641163;1;52.50;52.5;14.25;14.25193;629856;GIFT BAG HMK HB ANYDAY 2 COLOR MINI 11629856;3;32.50;97.5;7.4;22.2194;629885;GIFT BAG HMK HB MINI FEMININE ANYDAY 11629885;1;32.50;32.5;7.12;7.12195;758321;GIFT BAG HMK XHB BIG CONTEMPORARY 12758321;1;52.50;52.5;10.3;10.3196;846085;GIFT BOX HMK KBX ORANGE EMBOSSED SML 11846085;1;94.75;94.75;42.35;42.34197;501516;GIFT BAG HMK XPB SNOWMAN LRG 12501516;1;59.00;59;16.26;16.26198;745655;GIFT BAG HMK PB FLOWERS PINK HANDLE LRG 11745655;1;59.00;59;15.96;15.96199;745135;GIFT BAG HMK PB HAPPY BIRTHDAY CANDLES SML 11745135;1;32.50;32.5;10.65;10.64200;745665;GIFT BAG HMK PB STRIPES BLUE HANDLE LRG 11745665;5;59.00;295;15.96;79.8201;758354;GIFT BAG HMK XHB MINI 1 COLOR 12758354;6;29.50;177;13.66;40.98202;501776;GIFT BAG HMK XPB SM GREEN BAG WITH PVC WINDOW MED 12501776;1;64.75;64.75;19.63;19.63203;745705;GIFT BAG HMK PB WITH LACE MINT GREEN SML 11745705;1;35.50;35.5;9.98;9.98204;745685;GIFT BAG HMK PB WITH LACE LILAC SML 11745685;1;35.50;35.5;9.98;9.98205;745775;GIFT BAG HMK PB WITH LACE PINK LRG 11745775;1;59.50;59.5;17.1;17.1206;745785;GIFT BAG HMK PB WITH LACE MINT GREEN LRG 11745785;1;59.50;59.5;17.1;17.1207;745765;GIFT BAG HMK PB WITH LACE LILAC LRG 11745765;2;59.50;119;17.1;34.2208;758271;GIFT BAG HMK XHB BIG CONTEMPORARY 12758271;5;52.50;262.5;10.3;51.52209;758211;GIFT BAG HMK XHB SMALL CONTEMPORARY 12758211;2;42.50;85;16.62;16.62210;501786;GIFT BAG HMK XPB SM RED BAG WITH PVC WINDOW MED 12501786;2;64.75;129.5;19.63;39.26211;745795;GIFT BAG HMK PB WITH LACE LT BLUE LRG 11745795;1;59.50;59.5;17.1;17.1212;501796;GIFT BAG HMK XPB SM GREEN BAG WITH PVC WINDOW LRG 12501796;1;79.75;79.75;23.41;23.41213;745675;GIFT BAG HMK PB PEACOCK FEATHERS GRN LRG 11745675;2;59.00;118;31.92;31.92214;745715;GIFT BAG HMK PB WITH LACE LT BLUE SML 11745715;1;35.50;35.5;9.98;9.98215;501766;GIFT BAG HMK XPB SM RED BAG WITH PVC WINDOW SML 12501766;1;44.75;44.75;12.93;12.93216;501756;GIFT BAG HMK XPB SM GREEN BAG WITH PVC WINDOW SML 12501756;2;44.75;89.5;12.93;25.87217;939905;GIFT BAG HMK PB BROWN BATIK MED 11939905;1;46.50;46.5;13.95;13.95218;758171;GIFT BAG HMK XHB MINI CONTEMPORARY 12758171;13;32.50;422.5;6.37;82.81219;758111;GIFT BAG HMK XHB TINY CONTEMPORARY 12758111;25;24.50;612.5;9.44;117.93220;501496;GIFT BAG HMK XPB SANTA LRG 12501496;4;59.00;236;32.52;65.04221;758441;GIFT BAG HMK XBTB BIG CONTEMPORARY 12758441;11;42.50;467.5;7.91;86.1222;758291;GIFT BAG HMK XHB BIG CONTEMPORARY 12758291;6;52.50;315;10.3;61.82223;628084;GIFT BAG HMK HB MINI BIRTHDAY 11628084;2;32.50;65;15.56;15.56224;758484;GIFT BAG HMK XHB TINY JUVENILE 12758484;41;24.50;1004.5;155.76;193.46225;758485;GIFT BAG HMK XHB TINY OH WHAT FUN 12758485;14;24.50;343;90.96;106.12226;758514;GIFT BAG HMK XHB TINY 1 COLOR 12758514;22;22.50;495;83.68;115.06227;758274;GIFT BAG HMK XHB MINI 1 COLOR 12758274;4;29.50;118;20.49;27.32228;501136;GIFT BAG HMK XPB SLEIGH LRG 12501136;1;84.75;84.75;23.32;23.32229;939367;GIFT BAG HMK PB FLORAL 11939367;1;63.00;63;19.13;19.13230;939648;GIFT BAG HMK PB FUCHSIA DOTS LRG 11939648;1;69.50;69.5;23.38;23.38231;939837;GIFT BAG HMK PB ORANGE EMBOSSED LRG 11939837;1;74.00;74;25.75;25.75232;939127;GIFT BAG HMK PB HEART BALLOON BIG 11939127;1;89.50;89.5;29.97;29.96233;939107;GIFT BAG HMK PB HEART BALLOON SML 11939107;2;63.00;126;20.89;41.78234;501346;GIFT BAG HMK XPB GOLD ORNAMENTS LRG 12501346;2;79.50;159;22.75;45.5235;501146;GIFT BAG HMK XPB REINDEER LRG 12501146;1;84.75;84.75;23.32;23.32236;501366;GIFT BAG HMK XPB GOLD STARS LRG 12501366;3;79.50;238.5;22.75;68.26237;745745;GIFT BAG HMK PB WITH LACE MINT GREEN MED 11745745;9;49.50;445.5;14.73;132.57238;758494;GIFT BAG HMK XHB TINY JUVENILE 12758494;19;24.50;465.5;80.24;89.66239;628244;GIFT BAG HMK HB WEDDING 11628244;9;65.00;585;36.74;165.33240;628264;GIFT BAG HMK HB WEDDING 11628264;6;65.00;390;73.48;110.22241;939524;GIFT BAG HMK PB DK BLUE AND LT BLUE LRG 11939524;2;52.50;105;28.48;56.96242;939302;GIFT BAG HMK PB BLACK WINE 11939302;1;30.00;30;20.64;20.64243;628254;GIFT BAG HMK HB WEDDING 11628254;6;65.00;390;55.11;110.22244;629335;GIFT BAG HMK HB BIG BROWN DOTTED TEXT 11629335;4;52.50;210;41.58;55.44245;939375;GIFT BAG HMK PB MAROON VERT VINTAGE 11939375;1;32.50;32.5;18.12;18.12246;936030;C&S METAL FLOWER W ADH PNK 3IN;1;24.50;24.5;7.68;7.68247;939154;GIFT BAG HMK PB BALLOONS BIG 11939154;9;44.50;400.5;88.12;198.27248;939203;GIFT BAG HMK PB WINE BROWN FLORAL 11939203;2;13.50;27;26;26249;939340;GIFT BAG HMK PB BROWN WINE;2;46.50;93;15.31;30.62250;939081;GIFT BAG HMK PB BLUE GLITTERED WI;4;44.50;178;30.1;60.2251;939071;GIFT BAG HMK B1T1 WHITE GLITTERED;1;44.50;44.5;15.05;15.05252;939101;GIFT BAG HMK B1T1 PB LAVENDER GLI;1;44.50;44.5;15.05;15.05253;762134;GIFT BAG IMPTD PB LT PINK CUFF WINE 41762134;1;37.00;37;15.18;15.18254;939390;GIFT BAG HMK PB SKY BLUE WINE;1;46.50;46.5;15.31;15.31255;939802;GIFT BAG HMK PB YELLOW W FEATHERS;4;44.50;178;58.48;58.48256;939811;GIFT BAG HMK PB PINK W LAMINATED CUFF 11939811;1;22.50;22.5;14.62;14.62257;762641;GIFT BAG IMPTD (B1T1)  PB SPIRAL SM;1;49.50;49.5;17.06;17.06258;762602;GIFT BAG IMPTD PB RED SINGLE HANDLE;2;49.50;99;16.25;32.5259;939282;GIFT BAG HMK PB AGREEN SOLID LRG;1;19.75;19.75;12.9;12.9260;939831;GIFT BAG HMK PB BLUE W LAMINATED CUFF 11939831;2;27.00;54;36.12;36.12261;939750;GIFT BAG (B1T1) HMK PB ROSE TIP-ON;1;49.50;49.5;15.39;15.39262;939146;GIFT BAG HMK PB BROWN DIAMOND SML 11939146;1;22.50;22.5;6.7;6.7263;939153;GIFT BAG HMK PB BLUE STRIPES 11939153;1;46.50;46.5;24.18;24.18264;762671;GIFT BAG IMPTD (B1T1) PB SPIRAL MED;1;59.00;59;20.13;20.13265;939370;GIFT BAG HMK PB A.GREEN WINE;1;46.50;46.5;15.31;15.31266;628044;GIFT BAG HMK HB TINY BIRTHDAY 11628044;6;24.50;147;18.3;36.6267;629015;GIFT BAG HMK HB TINY FEMININE FLORAL 11629015;3;24.50;73.5;16.65;16.65268;628034;GIFT BAG HMK HB TINY BIRTHDAY 11628034;1;24.50;24.5;6.1;6.1269;939264;GIFT BAG HMK PB PINK KRAFT SML 11939264;1;24.50;24.5;9.5;9.5270;628214;GIFT BAG HMK HB WEDDING 11628214;3;52.50;157.5;29.78;44.67271;762262;GIFT BAG IMPTD PB BLUE BABY BOTTLE 41762262;1;27.00;27;19.78;19.78272;169012;GIFT BAG HMK ADUHB PURPLE MATRYOSHKA 11169012;2;52.50;105;27.7;27.7273;939143;GIFT BAG HMK PB PINK STRIPES 11939143;1;46.50;46.5;24.18;24.18274;939134;GIFT BAG HMK PB BALLOONS SML 11939134;2;32.50;65;35.46;35.46275;939801;GIFT BAG HMK PB BLUE W LAMINATED CUFF;1;22.50;22.5;14.62;14.62276;762054;GIFT BAG IMPTD PB RED CUFF MED 41762054;1;37.00;37;16.22;16.22277;629696;GIFT BAG HMK HB 1 COLOR SMALL 11629696;1;42.50;42.5;8.68;8.68278;939010;GIFT BAG (B1T1) HMK PB GRL POP-UP;1;35.25;35.25;21.6;21.6279;939481;GIFT BAG HMK PB FLWRS ;1;42.50;42.5;13.33;13.33280;762730;GIFT BAG IMPTD SOLID AQUA BLUE LRG 41762730;1;19.75;19.75;15;15281;939213;GIFT BAG HMK PB WINE PAISLEY 11939213;1;27.00;27;13;13282;629633;GIFT BAG HMK BTB BEER ROWS;1;42.50;42.5;9.1;9.1283;939040;GIFT BAG (B1T1) HMK PB BOY POP-UP;1;39.50;39.5;26.1;26.1284;629517;HB BIG PINK STRIPED CELEBRATE!;1;52.50;52.5;17.75;17.75285;939675;GIFT BAG HMK PB PINK ZIPPER DES MATTE SML 11939675;1;24.50;24.5;12.14;12.14286;939531;GIFT BAG HMK PB BABY CARRIAGE LARGE;2;42.50;85;27.56;27.56287;879148;DHB ARIEL BELLE CINDERELLA;1;52.50;52.5;14.52;14.52288;939607;GIFT BAG HMK PB PINK BIG 11939607;1;32.50;32.5;10.5;10.5289;939617;GIFT BAG HMK PB VIOLET BIG 11939617;1;32.50;32.5;10.5;10.5290;939597;GIFT BAG HMK PB BLUE BIG 11939597;1;32.50;32.5;10.5;10.5291;939541;GIFT BAG HMK PB BABY BOOTIE LARGE 1;1;42.50;42.5;13.76;13.76292;939292;GIFT BAG HMK PB ORANGE SOLID LRG 11939292;1;19.75;19.75;12.9;12.9293;762950;GIFT BAG IMPTD PB OCEAN BLUE PEPER;1;24.50;24.5;15.85;15.85294;939097;GIFT BAG HMK PB LOVE SML 11939097;1;63.00;63;20.89;20.89295;939164;GIFT BAG HMK PB CAKE BIG 11939164;1;44.50;44.5;22.03;22.03296;629734;GIFT BAG HMK HB SMALL ANYDAY LOVE 11629734;1;42.50;42.5;9.26;9.26297;762839;GIFT BAG (B1T1) PB PRTD GRN FLRL LR;2;52.50;105;37.8;37.8298;762180;GIFT BAG IMPTD PB MAROON MED;1;42.50;42.5;15.9;15.9299;939703;GIFT BAG HMK PB PLAIN KRAFT SILVER XL 11939703;1;32.50;32.5;11.98;11.98300;762201;GIFT BAG IMPTD PB RED BG BLACK FLOCK MED 41762201;1;11.75;11.75;19.89;19.89301;762499;GIFT BAG B1T1 HMK PB APPLEGRN LRG;1;39.50;39.5;15;15302;629326;GIFT BAG HMK HB SMALL FOR HIM 11629326;1;42.50;42.5;9.26;9.26303;939603;GIFT BAG HMK PB PLAIN KRAFT GREEN MED 11939603;6;19.75;118.5;7.23;43.38304;939623;GIFT BAG HMK PB PLAIN KRAFT SILVER MED 11939623;1;19.75;19.75;7.23;7.23305;629866;GIFT BAG HMK HB ANYDAY 2 COLOR SMALL 11629866;9;42.50;382.5;26.64;79.92306;629775;GIFT BAG HMK HB TINY BABY 11629775;1;24.50;24.5;5.55;5.55307;501225;GIFT BAG HMK XPB CHEVRON GRN RED XSML 12501225;4;35.50;142;47.92;47.92308;629354;GIFT BAG HMK HB TINY ANYDAY LOVE 11629354;1;24.50;24.5;5.9;5.9309;758234;GIFT BAG HMK XHB TINY 1 COLOR 12758234;12;22.50;270;57.53;62.76310;758214;GIFT BAG HMK XHB TINY 1 COLOR 12758214;14;22.50;315;73.22;73.22311;758204;GIFT BAG HMK XHB TINY 1 COLOR 12758204;32;22.50;720;99.37;167.36312;758504;GIFT BAG HMK XHB TINY JUVENILE 12758504;41;24.50;1004.5;113.28;193.42313;501215;GIFT BAG HMK XPB OGEE GRN RED XSML 12501215;6;35.50;213;71.88;71.88314;758254;GIFT BAG HMK XHB TINY FORMAL 12758254;26;24.50;637;89.68;122.69315;758515;GIFT BAG HMK XHB TINY MITTENS ON GREEN 12758515;7;22.50;157.5;37.9;53.06316;758495;GIFT BAG HMK XHB TINY ORNAMENTS ON WHITE 12758495;2;24.50;49;15.16;15.16317;501045;GIFT BAG HMK XPB SWIRLS GRN FOIL XSML 12501045;9;29.50;265.5;42.2;94.95318;758255;GIFT BAG HMK XHB TINY IKAT FLOWERS STRIPE 12758255;14;24.50;343;53.06;106.14319;758215;GIFT BAG HMK XHB TINY I HEART SANTA 12758215;1;22.50;22.5;7.58;7.58320;758224;GIFT BAG HMK XHB TINY 1 COLOR 12758224;28;22.50;630;115.06;146.44321;758252;GIFT BAG HMK XHB TINY PAROLS AND DOTS;2;24.50;49;14.96;14.96322;758225;GIFT BAG HMK XHB TINY MITTENS ON RED 12758225;5;22.50;112.5;30.32;37.9323;758245;GIFT BAG HMK XHB TINY RED AND GOLD TEXT STRIPE 12758245;5;24.50;122.5;37.9;37.9324;758264;GIFT BAG HMK XHB TINY PASKONG PINOY 12758264;21;24.50;514.5;70.8;99.09325;758222;GIFT BAG HMK XHB TINY RED ICON;1;22.50;22.5;7.22;7.22326;758244;GIFT BAG HMK XHB TINY FORMAL 12758244;16;24.50;392;70.8;75.51327;758265;GIFT BAG HMK XHB TINY RED IKAT DIAMOND PATTERN 12758265;7;24.50;171.5;30.32;53.07328;758524;GIFT BAG HMK XHB TINY 1 COLOR 12758524;13;22.50;292.5;57.53;67.99329;758235;GIFT BAG HMK XHB TINY FALALA ON RED 12758235;8;22.50;180;37.9;60.65330;501015;GIFT BAG HMK XPB CMAS TREE GRN FOIL XSML 12501015;7;29.50;206.5;42.2;73.85331;758404;GIFT BAG HMK XHB MINI JUVENILE  12758404;1;32.50;32.5;6.37;6.37332;758134;GIFT BAG HMK XHB MINI 1 COLOR 12758134;8;29.50;236;27.32;54.64333;758594;GIFT BAG HMK XBTB SML JUVENILE 12758594;10;26.00;260;47.76;59.7334;629025;GIFT BAG HMK HB TINY FEMININE FLORAL 11629025;2;24.50;49;11.1;11.1335;501265;GIFT BAG HMK XPB CHEVRON GRN RED SML 12501265;2;49.50;99;17.2;34.4336;758384;GIFT BAG HMK XHB MINI JUVENILE 12758384;4;32.50;130;25.48;25.48337;758044;GIFT BAG HMK XHB SML FORMAL  12758044;1;42.50;42.5;8.31;8.31338;758024;GIFT BAG HMK XHB MINI FORMAL 12758024;3;32.50;97.5;19.11;19.11339;501245;GIFT BAG HMK XPB XMAS JOY XSML 12501245;2;35.50;71;23.96;23.96340;758114;GIFT BAG HMK XBTB BIG FORMAL 12758114;1;42.50;42.5;7.91;7.91341;758604;GIFT BAG HMK XBTB SML JUVENILE 12758604;24;26.00;624;71.64;143.29342;758512;GIFT BAG HMK TINY GRN ICON SQUARES;1;22.50;22.5;7.22;7.22343;501235;GIFT BAG HMK XPB REINDEER XSML 12501235;4;35.50;142;47.92;47.92344;501035;GIFT BAG HMK XPB REINDEER RED FOIL XSML 12501035;9;29.50;265.5;52.75;94.95345;758205;GIFT BAG HMK XHB TINY HOHOHO CANDIES 12758205;12;22.50;270;68.22;90.96346;758525;GIFT BAG HMK XHB TINY FALALA ON GREEN 12758525;5;22.50;112.5;37.9;37.9347;629105;GIFT BAG HMK HB TINY BROWN DOTTED TEXT 11629105;2;24.50;49;15.16;15.16348;629122;GIFT BAG HMK HB TINY BLU;4;24.50;98;14.96;29.92349;629242;GIFT BAG HMK HB TINY BLUE INDIAN;1;24.50;24.5;7.22;7.22350;629021;GIFT BAG HMK HB TINY ARGYLE BLUANDGRN;1;24.50;24.5;7.48;7.48351;758212;GIFT BAG HMK XHB TINY MERRY CMAS;3;22.50;67.5;21.66;21.66352;501025;GIFT BAG HMK XPB ORNAMENTS RED FOIL XSML 12501025;6;29.50;177;42.2;63.3353;629121;GIFT BAG HMK HB TINY GREENANDBROWN ST;2;24.50;49;7.14;14.28