PRIMESTOCK; AND; DEFECTIVE ITEMS;;;;;TRANSACTION:;T_INV0120160812690;;;;;DISPOSAL REFNO:;D20160819028TYPE: ; CHOPPING;;;;;POSTED DATE:;0000-00-00LINE NO;ITEM #;DESCRIPTION;TOTAL QTY;SRP;SRP AMOUNT;PRODUCT COST;PROD COST AMOUNT1;648025;GIFT WRAP CRAYOLA SERPENTINE 31648025;1;13.50;13.5;3;32;629144;GIFT BAG HMK HB TINY ANYDAY LOVE 11629144;1;24.50;24.5;5.9;5.93;260055;GIFT WRAP HMK EW FEMININE FLORAL 11260055;2;13.50;27;6.2;6.24;171022;GIFT WRAP HMK EW ADUEW BLUE AND YELLOW MATRYOSHKA 11171022;1;13.50;13.5;3.3;3.35;831042;GIFT WRAP IMPTD XEW STCKINGS 42831042;3;26.00;78;6.98;20.946;260181;GIFT WRAP HMK EW BIRTHDAY 11260181;1;13.50;13.5;3.5;3.57;260071;GIFT WRAP HMK EW BIRTHDAY 11260071;1;13.50;13.5;3.5;3.58;260381;GIFT WRAP HMK EW BIRTHDAY 11260381;1;13.50;13.5;3.5;3.59;260146;GIFT WRAP HMK EW BIRTHDAY 11260146;1;13.50;13.5;3.5;3.510;260111;GIFT WRAP HMK EW BIRTHDAY 11260111;1;13.50;13.5;3.5;3.511;884685;GIFT WRAP HMK HWC KRAFT RED 11884685;1;19.75;19.75;7;6.112;260371;GIFT WRAP HMK EW BIRTHDAY 11260371;1;13.50;13.5;3.5;3.513;260013;GIFT WRAP HMK EW WEDDING 11260013;1;13.50;13.5;3.18;3.1814;260081;GIFT WRAP HMK EW BIRTHDAY 11260081;1;13.50;13.5;3.5;3.515;884745;GIFT WRAP HMK HWC ORANGE DAMASK 11884745;1;56.50;56.5;19.6;19.616;884645;GIFT WRAP HMK HWC CREAM WITH GOLD INK 11884645;1;32.50;32.5;10.91;10.917;648035;GIFT WRAP CRAYOLA DOTS 31648035;1;13.50;13.5;3;318;884635;GIFT WRAP HMK HWC VIOLET STARS MET 11884635;1;52.50;52.5;14.65;14.6419;260232;GIFT WRAP HMK EW FEMININE ANYDAY 11260232;1;13.50;13.5;3.1;3.120;648015;GIFT WRAP CRAYOLA GEOMETRIC 31648015;1;13.50;13.5;3;321;648045;GIFT WRAP CRAYOLA BRUSH STROKES 31648045;1;13.50;13.5;3;322;260063;GIFT WRAP HMK EW WEDDING 11260063;1;13.50;13.5;3.55;3.5523;884237;GIFT WRAP HMK HWC PINK CHEVRON 11884237 MM;1;19.75;19.75;6.75;6.7524;260403;GIFTWRAP HMK EW WEDDING 11260403;3;13.50;40.5;10.65;10.6525;884257;GIFT WRAP HMK HWC ORANGE CHEVRON 11884257 MM;1;19.75;19.75;6.75;6.7526;884247;GIFT WRAP HMK HWC APPLE GREEN CHEVRON 11884247 MM;1;19.75;19.75;6.75;6.7527;884317;GIFT WRAP HMK HWC GREEN BG YELLOW FLOWER 11884317;1;29.50;29.5;6.62;6.6228;884367;GIFT WRAP HMK HWC BLACK AND YELLOW VICTORIAN PATTERN 11884367;1;29.50;29.5;6.62;6.6229;884337;GIFT WRAP HMK HWC YELLOW BLUE CHECKERED 11884337;1;29.50;29.5;6.62;6.6230;884475;GIFT WRAP HMK HWC YELLOW LEAVES 11884475;1;29.50;29.5;6.62;6.6231;884485;GIFT WRAP HMK HWC YELGREEN BACKGROUND 11884485;1;29.50;29.5;6.62;6.6232;884435;GIFT WRAP HMK HWC LAVENDER BG 11884435;1;29.50;29.5;6.62;6.6233;884455;GIFT WRAP HMK HWC GREEN SWIRL 11884455;1;29.50;29.5;6.62;6.6234;884425;GIFT WRAP HMK HWC BUTTERFLIES 11884425;1;29.50;29.5;6.62;6.6235;884465;GIFT WRAP HMK HWC YELLOW CIRCLE 11884465;1;29.50;29.5;6.62;6.6236;884695;GIFT WRAP HMK HWC KRAFT GREEN 11884695;1;19.75;19.75;7;6.137;884705;GIFT WRAP HMK HWC KRAFT SILVER 11884705;1;19.75;19.75;7.48;7.4838;884925;GIFT WRAP HMK HWC RED SQUARES 11884925;1;56.50;56.5;18.78;18.7839;884915;GIFT WRAP HMK HWC VIOLET SQUARES 11884915;1;56.50;56.5;18.78;18.7840;884905;GIFT WRAP HMK HWC LT BLUE SQUARES 11884905;1;56.50;56.5;18.78;18.7841;884605;GIFT WRAP HMK HWC LTBLUE STARS MET 11884605;1;52.50;52.5;14.65;14.6442;884445;GIFT WRAP HMK HWC PURPLE FLOWERS 11884445;1;29.50;29.5;6.62;6.6243;884625;GIFT WRAP HMK HWC GREEN STARS MET 11884625;1;52.50;52.5;14.65;14.6444;884615;GIFT WRAP HMK HWC RED STARS MET 11884615;1;52.50;52.5;14.65;14.6445;260241;GIFT WRAP HMK EW BIRTHDAY 11260241;1;13.50;13.5;3.5;3.546;260393;GIFT WRAP HMK EW WEDDING 11260393;2;13.50;27;6.36;6.3647;260343;GIFT WRAP HMK EW WEDDING 11260343;1;13.50;13.5;3.55;3.5548;884347;GIFT WRAP HMK HWC COLORFUL CIRCLES 11884347;1;29.50;29.5;6.62;6.6249;884327;GIFT WRAP HMK HWC YELLOW FLOWERS 11884327;1;29.50;29.5;6.62;6.6250;884357;GIFT WRAP HMK HWC RED BG YELLOW CIRCLES 11884357;1;29.50;29.5;6.62;6.6251;884036;GIFT WRAP HMK HWC MAPLE LEAVES 11884036;1;29.50;29.5;6.62;6.6252;884377;GIFT WRAP HMK HWC BLACK BG BAROQUE PATTERN 11884377;1;29.50;29.5;6.62;6.6253;884026;GIFT WRAP HMK HWC GREEN AND PURPLE FLOWERS 11884026;1;29.50;29.5;6.62;6.6254;884066;GIFT WRAP HMK HWC FLOWERS WHITE BG 11884066;1;29.50;29.5;6.62;6.6255;884076;GIFT WRAP HMK HWC GREEN VINES 11884076;1;29.50;29.5;6.62;6.6256;884046;GIFT WRAP HMK HWC VINTAGE VINES 11884046;1;29.50;29.5;6.62;6.6257;884056;GIFT WRAP HMK HWC FLOWERS PURPLE BG 11884056;1;29.50;29.5;6.62;6.6258;884675;GIFT WRAP HMK HWC DK BLUE WITH GOLD INK 11884675;1;32.50;32.5;10.91;10.959;884086;GIFT WRAP HMK HWC PURPLE PAISLEY 11884086;1;29.50;29.5;6.62;6.6260;884665;GIFT WRAP HMK HWC RED WITH GOLD INK 11884665;1;32.50;32.5;10.91;10.961;884725;GIFT WRAP HMK HWC NEON BLUE DAMASK 11884725;1;56.50;56.5;19.6;19.662;884735;GIFT WRAP HMK HWC NEON PURPLE DAMASK 11884735;1;56.50;56.5;19.6;19.663;884805;GIFT WRAP HMK HWC CREAM STRIPES 11884805;1;46.50;46.5;16.02;16.0264;884825;GIFT WRAP HMK HWC COPPER STRIPES 11884825;1;46.50;46.5;16.02;16.0265;884955;GIFT WRAP HMK HWC BLUE WHITE STRIPES 11884955;1;56.50;56.5;18.78;18.7866;939447;GIFT BAG HMK PB EMB RED BIG 11939447;1;79.50;79.5;26.06;26.0667;260036;GIFT WRAP HMK EW FOR HER 11260036;1;13.50;13.5;3.45;3.4568;642308;GIFT WRAP HMK NKEW DORA WHAT A PARTY 91642308;1;13.50;13.5;3.2;3.269;642298;GIFT WRAP HMK NKEW DORA WHAT A MAGIC TRICK 91642298;1;13.50;13.5;3.2;3.270;864657;GIFT WRAP HMK DEW BALLOONS 81864657;1;13.50;13.5;3.2;3.271;864667;GIFT WRAP HMK DEW NATURE 81864667;1;13.50;13.5;3.2;3.272;864647;GIFT WRAP HMK DEW JIGSAW 81864647;1;13.50;13.5;3.2;3.273;868559;GIFT WRAP HMK DEW LOVELY AND SWEET 81868559;1;13.50;13.5;3.2;3.274;868589;GIFT WRAP HMK DEW PRINCESS SWIRLS 81868589;1;13.50;13.5;3.2;3.275;868569;GIFT WRAP HMK DEW PRINCESSES DREAM 81868569;1;13.50;13.5;3.2;3.276;642328;GIFT WRAP HMK NKEW DORA LETS DRESS UP;1;13.50;13.5;3.2;3.277;171032;GIFT WRAP HMK EW ADUEW PINK AND TURQUOISE MATRYOSHKA 11171032;1;13.50;13.5;3.3;3.378;260153;GIFT WRAP HMK EW WEDDING 11260153;2;13.50;27;6.36;6.3679;171042;GIFT WRAP HMK EW ADUEW LTPINK AND BROWN MATRYOSHKA 11171042;1;13.50;13.5;3.3;3.380;884267;GIFT WRAP HMK HWC MINT GREEN CHEVRON 11884267 MM;1;19.75;19.75;6.75;6.7581;884655;GIFT WRAP HMK HWC PINK WITH GOLD INK 11884655;1;32.50;32.5;10.91;10.982;884785;GIFT WRAP HMK HWC BEIGE FLOWER GARDEN 11884785;1;65.50;65.5;22.9;22.983;884755;GIFT WRAP HMK HWC BROWN DAMASK 11884755;1;56.50;56.5;19.6;19.684;884815;GIFT WRAP HMK HWC BROWN AND BLUE STRIPES 11884815;1;46.50;46.5;16.02;16.0285;884016;GIFT WRAP HMK HWC FLOWERS YELLOW BG 11884016;1;29.50;29.5;6.62;6.6286;769021;GIFT WRAP HMK EGEW BIRDS WITH DOTS 11769021;2;13.50;27;6.9;6.987;769011;GIFT WRAP HMK EGEW FLOWER BUDS WITH DARK BRWN BG  11769011;2;13.50;27;6.9;6.988;769041;GIFT WRAP HMK EGEW AQUA FLOWERS WITH LIGHT BROWN BG 11769041;4;13.50;54;13.8;13.889;856410;GIFT WRAP HMK DEW MICKEY YAHOO;1;13.50;13.5;3.1;3.190;905031;GIFT WRAP HMK DEW MARIE FLORAL;1;13.50;13.5;3.1;3.191;856420;GIFT WRAP HMK DEW MICKEY ICONS;1;13.50;13.5;3.1;3.192;856400;GIFT WRAP HMK DEW MINNIE DOTS;1;13.50;13.5;3.1;3.193;856390;GIFT WRAP HMK DEW MINNIE SQUARES;1;13.50;13.5;3.1;3.194;905041;GIFT WRAP HMK DEW MARIE DOTS;1;13.50;13.5;3.1;3.195;876021;GIFT WRAP HMK DEW STITCHANDANGEL FLRL;1;13.50;13.5;3.1;3.196;868519;GIFTWRAP HMK DEW PRNCES SUMR PALACE;1;13.50;13.5;3.2;3.297;635220;GIFTWRAP HMK NKEW SB FLOWERS;1;13.50;13.5;3.2;3.298;635210;GIFTWRAP HMK NKEW SB SAILNG PATRICK;1;13.50;13.5;3.2;3.299;884225;GIFT WRAP HMK HWC GREEN SWIRLS 11884225;1;32.50;32.5;8.87;8.87100;171012;GIFT WRAP HMK EW ADUEW PURPLE MATRYOSHKA 11171012;1;13.50;13.5;3.3;3.3101;642318;GIFT WRAP HMK NKEW DORA ITS A MASQUERADE 91642318;1;13.50;13.5;3.2;3.2102;884205;GIFT WRAP HMK HWC RED SWIRLS 11884205;1;32.50;32.5;8.87;8.87103;884215;GIFT WRAP HMK HWC BLUE SWIRLS 11884215;1;32.50;32.5;8.87;8.87104;884661;GIFTWRAP HMK HWC RED METALLIC;1;17.75;17.75;7.31;7.31105;425024;GIFT WRAP HMK XW FORMAL 12425024;3;13.50;40.5;8.2;12.3106;425124;GIFT WRAP HMK XW FORMAL LETTERING 12425124;2;13.50;27;8.2;8.2107;425414;GIFT WRAP HMK XW CONTEMPORARY 12425414;1;13.50;13.5;3.1;3.1108;425194;GIFT WRAP HMK XW JUVENILE 12425194;1;13.50;13.5;3.9;3.9109;425104;GIFT WRAP HMK XW FORMAL LETTERING 12425104;1;13.50;13.5;4.1;4.1110;425054;GIFT WRAP HMK XW FORMAL 12425054;1;13.50;13.5;4.1;4.1111;425064;GIFT WRAP HMK XW FORMAL 12425064;1;13.50;13.5;4.1;4.1112;425114;GIFT WRAP HMK XW FORMAL LETTERING 12425114;1;13.50;13.5;4.1;4.1113;425144;GIFT WRAP HMK XW JUVENILE 12425144;1;13.50;13.5;3.9;3.9114;425014;GIFT WRAP HMK XW FORMAL 12425014;1;13.50;13.5;4.1;4.1115;425224;GIFT WRAP HMK XW JUVENILE 12425224;1;13.50;13.5;3.9;3.9116;425424;GIFT WRAP HMK XW CONTEMPORARY 12425424;1;13.50;13.5;3.1;3.1117;425134;GIFT WRAP HMK XW FORMAL LETTERING 12425134;1;13.50;13.5;3.9;3.9118;884715;GIFT WRAP HMK HWC KRAFT GOLD 11884715;1;19.75;19.75;7.48;7.48119;260203;GIFT WRAP HMK EW WEDDING 11260203;2;13.50;27;7.1;7.1120;260273;GIFT WRAP HMK EW WEDDING 11260273;1;13.50;13.5;3.18;3.18121;884595;GIFT WRAP HMK HWC BDAY PHRASES 11884595;1;35.50;35.5;11.6;11.6122;884387;GIFT WRAP HMK HWC BLUE SCROLL 11884387;1;29.50;29.5;6.62;6.62123;260453;GIFT WRAP HMK EW WEDDING 11260453;1;13.50;13.5;3.18;3.18124;884185;GIFT WRAP HMK HWC RED FLOWERS 11884185;1;32.50;32.5;11.35;11.34125;884175;GIFT WRAP HMK HWC GREEN FLOWERS 11884175;1;32.50;32.5;11.35;11.34126;884195;GIFT WRAP HMK HWC BLUE FLOWERS 11884195;1;32.50;32.5;11.35;11.34127;884165;GIFT WRAP HMK HWC VIOLET FLOWERS 11884165;1;32.50;32.5;11.35;11.34128;884974;GIFT WRAP HMK HWC AQUA BLUE WAVES AND CIRCLES 11884974;1;52.50;52.5;18.4;18.4129;884934;GIFT WRAP HMK HWC VIOLET FLORAL HMADE 11884934;1;44.50;44.5;17.35;17.34130;884924;GIFT WRAP HMK HWC GREEN FLORAL HMADE 11884924;1;44.50;44.5;17.35;17.34131;884914;GIFT WRAP HMK HWC BLUE FLORAL HMADE 11884914;1;44.50;44.5;17.35;17.34132;884944;GIFT WRAP HMK HWC BROWN FLORAL HMADE 11884944;1;44.50;44.5;17.35;17.34133;884255;GIFT WRAP HMK HWC AQUA BLUE CHECKERED 11884255;1;32.50;32.5;8.87;8.87134;884245;GIFT WRAP HMK HWC DK BLUE CHECKERED 11884245;1;32.50;32.5;8.87;8.87135;884235;GIFT WRAP HMK HWC RED CHECKERED 11884235;1;32.50;32.5;8.87;8.87136;641032;GIFT BAG HMK EGHB LARGE BAG AUTUMN GRUNGE 11641032;1;65.00;65;14.95;14.95137;272020;GIFT BAG HMK BYHB GREEN DIAMOND 11272020;1;59.50;59.5;16;16138;758364;GIFT BAG HMK XHB SML 1 COLOR 12758364;62;39.50;2449;26.82;554.28139;629015;GIFT BAG HMK HB TINY FEMININE FLORAL 11629015;2;24.50;49;10.92;10.92140;641021;GIFTBAG HMK EGHB LRGBAG WFUCH FOIL;1;32.50;32.5;21;21141;528084;GIFT WRAP ROLL HMK 3IN LP 12528084;1;21.75;21.75;7.68;7.68142;629195;GIFT BAG HMK HB BIG PINK VICTORIAN 11629195;1;52.50;52.5;13.86;13.86143;758234;GIFT BAG HMK XHB TINY 1 COLOR 12758234;3;22.50;67.5;10.46;15.69144;629476;GIFT BAG HMK HB MINI FOR HIM 11629476;1;32.50;32.5;7;7145;939208;GIFT BAG HMK PB YGREEN DOTS RIB BIG 11939208;11;52.50;577.5;18.7;205.7146;939228;GIFT BAG HMK PB PINK FLOWER RIB BIG 11939228;1;52.50;52.5;18.7;18.7147;939448;GIFT BAG HMK PB APPLE GREEN SOLID LRG 11939448;1;37.00;37;10.61;10.6148;939118;GIFT BAG HMK PB ORANGE FLORAL EMB MED 11939118;1;63.00;63;22.43;22.43149;276035;CARD HMK LGC BIRTHDAY WISHES FOR A 11276035;1;105.00;105;39.7;39.7150;213038;CARD HMK W HEADS IN THE CLOUDS 11213038;1;46.50;46.5;2.07;2.06151;068158;CARD HMK B OUR LOVE IS SPECIAL BABY 11068158;1;59.00;59;1.86;1.86152;939418;GIFT BAG HMK PB YELLOW SOLID LRG 11939418;4;37.00;148;10.61;42.42153;939325;GIFT BAG HMK PB PURPLE WITH FLOWERS SML 11939325;1;24.50;24.5;13;13154;742032;GIFT BAG HMK XGRB MAY THE WONDERFUL...12-742032;1;29.50;29.5;8.78;8.78155;952031;CARD HMK CB TODAY ANYTHING 11952031;1;159.50;159.5;33.95;33.95156;699293;CRAFT EASY ART SET CE PINK SATCHEL AND PURSE PAPER ART 41699293;1;80.00;80;26.76;26.76;;;249;;7888.5;;2145.31